{
  "spec_id": "visual_syntax_spec_CAR-JUX-Haircolor-1-1-10_6a286c70a758248c",
  "spec_version": "1.0.0",
  "harness_definition_id": "CAR-JUX-Haircolor-1-1-10",
  "category_id": "carousels",
  "grammar_family": "CAROUSEL_SWIPE_PROGRESSION",
  "slide_sequence": [
    {
      "slide_index": 0,
      "slide_role": "cover",
      "zones": [
        {
          "zone_type": "full_bleed",
          "layout_mode": "fill",
          "height_range_pct": {
            "min": 100.0,
            "max": 100.0
          },
          "y_anchor_range_pct": {
            "min": 0.0,
            "max": 90.0
          },
          "required": true,
          "max_children": 5,
          "primitives": [
            {
              "primitive_id": "prim_0_full_bleed_default",
              "primitive_type": "image_region",
              "semantic_role": "zone_placeholder",
              "syntax_role": "full_bleed:placeholder",
              "attribute_ranges": {
                "height_pct": {
                  "min": 100.0,
                  "max": 100.0
                },
                "width_pct": {
                  "min": 20.0,
                  "max": 100.0
                },
                "z_index_range": {
                  "min": 1,
                  "max": 5
                },
                "padding_px": {
                  "min": 8,
                  "max": 16
                },
                "overlap_allowed": false
              },
              "anchor_mode": "per_slide_variable",
              "why": "Standard container primitive for full_bleed",
              "protected_properties": [
                "primitive_type"
              ]
            }
          ]
        },
        {
          "zone_type": "overlay_zone",
          "layout_mode": "absolute",
          "height_range_pct": {
            "min": 30.0,
            "max": 60.0
          },
          "y_anchor_range_pct": {
            "min": 0.0,
            "max": 90.0
          },
          "required": true,
          "max_children": 5,
          "primitives": [
            {
              "primitive_id": "prim_0_overlay_zone_default",
              "primitive_type": "text_block",
              "semantic_role": "zone_placeholder",
              "syntax_role": "overlay_zone:placeholder",
              "attribute_ranges": {
                "height_pct": {
                  "min": 30.0,
                  "max": 60.0
                },
                "width_pct": {
                  "min": 20.0,
                  "max": 100.0
                },
                "z_index_range": {
                  "min": 1,
                  "max": 5
                },
                "padding_px": {
                  "min": 8,
                  "max": 16
                },
                "overlap_allowed": false
              },
              "anchor_mode": "per_slide_variable",
              "why": "Standard container primitive for overlay_zone",
              "protected_properties": [
                "primitive_type"
              ]
            }
          ]
        }
      ]
    },
    {
      "slide_index": 1,
      "slide_role": "cover",
      "zones": [
        {
          "zone_type": "full_bleed",
          "layout_mode": "fill",
          "height_range_pct": {
            "min": 100.0,
            "max": 100.0
          },
          "y_anchor_range_pct": {
            "min": 0.0,
            "max": 90.0
          },
          "required": true,
          "max_children": 5,
          "primitives": [
            {
              "primitive_id": "prim_1_full_bleed_default",
              "primitive_type": "image_region",
              "semantic_role": "zone_placeholder",
              "syntax_role": "full_bleed:placeholder",
              "attribute_ranges": {
                "height_pct": {
                  "min": 100.0,
                  "max": 100.0
                },
                "width_pct": {
                  "min": 20.0,
                  "max": 100.0
                },
                "z_index_range": {
                  "min": 1,
                  "max": 5
                },
                "padding_px": {
                  "min": 8,
                  "max": 16
                },
                "overlap_allowed": false
              },
              "anchor_mode": "per_slide_variable",
              "why": "Standard container primitive for full_bleed",
              "protected_properties": [
                "primitive_type"
              ]
            }
          ]
        },
        {
          "zone_type": "overlay_zone",
          "layout_mode": "absolute",
          "height_range_pct": {
            "min": 30.0,
            "max": 60.0
          },
          "y_anchor_range_pct": {
            "min": 0.0,
            "max": 90.0
          },
          "required": true,
          "max_children": 5,
          "primitives": [
            {
              "primitive_id": "prim_1_overlay_zone_default",
              "primitive_type": "text_block",
              "semantic_role": "zone_placeholder",
              "syntax_role": "overlay_zone:placeholder",
              "attribute_ranges": {
                "height_pct": {
                  "min": 30.0,
                  "max": 60.0
                },
                "width_pct": {
                  "min": 20.0,
                  "max": 100.0
                },
                "z_index_range": {
                  "min": 1,
                  "max": 5
                },
                "padding_px": {
                  "min": 8,
                  "max": 16
                },
                "overlap_allowed": false
              },
              "anchor_mode": "per_slide_variable",
              "why": "Standard container primitive for overlay_zone",
              "protected_properties": [
                "primitive_type"
              ]
            }
          ]
        }
      ]
    },
    {
      "slide_index": 2,
      "slide_role": "single_frame",
      "zones": [
        {
          "zone_type": "header_zone",
          "layout_mode": "vertical_stack",
          "height_range_pct": {
            "min": 15.0,
            "max": 30.0
          },
          "y_anchor_range_pct": {
            "min": 0.0,
            "max": 90.0
          },
          "required": true,
          "max_children": 5,
          "primitives": [
            {
              "primitive_id": "prim_2_header_zone_0_text_block",
              "primitive_type": "text_block",
              "semantic_role": "text_block_element",
              "syntax_role": "header_zone:text_block",
              "attribute_ranges": {
                "height_pct": {
                  "min": 5.0,
                  "max": 15.0
                },
                "width_pct": {
                  "min": 75.0,
                  "max": 85.0
                },
                "z_index_range": {
                  "min": 2,
                  "max": 10
                },
                "padding_px": {
                  "min": 4,
                  "max": 16
                },
                "overlap_allowed": false,
                "color_constraint": "contrast_ratio_min_4.5:1",
                "font_size_px": {
                  "min": 28,
                  "max": 36
                },
                "font_weight": [
                  "regular",
                  "medium",
                  "bold"
                ],
                "alignment": [
                  "center",
                  "left"
                ]
              },
              "anchor_mode": "per_slide_variable",
              "why": "Derived from specimen analysis frame 2 observation for text_block",
              "protected_properties": [
                "primitive_type",
                "anchor_mode"
              ]
            }
          ]
        },
        {
          "zone_type": "hero_zone",
          "layout_mode": "overlay",
          "height_range_pct": {
            "min": 45.0,
            "max": 70.0
          },
          "y_anchor_range_pct": {
            "min": 0.0,
            "max": 90.0
          },
          "required": true,
          "max_children": 5,
          "primitives": [
            {
              "primitive_id": "prim_2_hero_zone_1_image_region",
              "primitive_type": "image_region",
              "semantic_role": "image_region_element",
              "syntax_role": "hero_zone:image_region",
              "attribute_ranges": {
                "height_pct": {
                  "min": 65.0,
                  "max": 75.0
                },
                "width_pct": {
                  "min": 85.0,
                  "max": 95.0
                },
                "z_index_range": {
                  "min": 3,
                  "max": 10
                },
                "padding_px": {
                  "min": 4,
                  "max": 16
                },
                "overlap_allowed": false,
                "color_constraint": "contrast_ratio_min_4.5:1",
                "font_size_px": {
                  "min": 12,
                  "max": 20
                },
                "font_weight": [
                  "regular",
                  "medium"
                ],
                "alignment": [
                  "left"
                ]
              },
              "anchor_mode": "per_slide_variable",
              "why": "Derived from specimen analysis frame 2 observation for image_region",
              "protected_properties": [
                "primitive_type",
                "anchor_mode"
              ]
            }
          ]
        },
        {
          "zone_type": "footer_zone",
          "layout_mode": "horizontal_row",
          "height_range_pct": {
            "min": 10.0,
            "max": 20.0
          },
          "y_anchor_range_pct": {
            "min": 0.0,
            "max": 90.0
          },
          "required": true,
          "max_children": 5,
          "primitives": [
            {